{
  "schema_version": "2.0.0",
  "id": "AIMS-0001",
  "version": "1",
  "data_version": "0.1.0-draft",
  "nodes": [
    {"schema_version": "2.0.0", "id": "AIS-0001", "node_type": "search"},
    {"schema_version": "2.0.0", "id": "AIC-0001", "node_type": "condition"},
    {"schema_version": "2.0.0", "id": "AIA-0001", "node_type": "action"}
  ],
  "target_selectors": [
    {"schema_version": "2.0.0", "id": "ATS-0001"}
  ]
}
